[
  {
    "id": "post_001",
    "user_id": "demo_user",
    "post_type": "鱼获",
    "format": "图文",
    "author": "江风路亚",
    "avatar": "J",
    "title": "傍晚窗口 40 分钟，翘嘴连中 6 尾",
    "content": "青山江滩今天风小，亮片入水后第三竿就中。建议站在缓流边缘，收线不要太快。",
    "excerpt": "青山江滩今天风小，亮片入水后第三竿就中。",
    "meta": "青山江滩 · 路亚 · 亮片 · 24℃",
    "poi_id": "poi_002",
    "poi_name": "青山江滩路亚点",
    "record_id": null,
    "content_type": "鱼获",
    "fish_species": ["翘嘴"],
    "tags": ["#路亚", "#翘嘴", "#武汉钓点"],
    "images": [],
    "likes": 128,
    "comments": 36,
    "saves": 42,
    "coverTone": "blue",
    "visibility": "public",
    "location_visibility": "area_blur",
    "location_text": "青山江滩",
    "location_area_name": "武汉市",
    "latitude": null,
    "longitude": null,
    "equipment_ids": [],
    "created_at": "2026-06-02T00:00:00+00:00",
    "updated_at": "2026-06-02T00:00:00+00:00"
  },
  {
    "id": "post_002",
    "user_id": "demo_user",
    "post_type": "鱼获",
    "format": "视频",
    "author": "不空军的阿明",
    "avatar": "A",
    "title": "东湖早口鲫鱼不错，腥香拉饵更稳",
    "content": "这条视频记录了从找底、调漂到上鱼的完整流程，新手可以直接照着试一遍。",
    "excerpt": "东湖早口鲫鱼不错，腥香拉饵更稳。",
    "meta": "东湖听涛 · 台钓 · 鲫鱼 12 尾",
    "poi_id": "poi_001",
    "poi_name": "东湖听涛野钓点",
    "record_id": null,
    "content_type": "视频",
    "fish_species": ["鲫鱼"],
    "tags": ["#台钓", "#新手", "#鲫鱼"],
    "images": [],
    "likes": 96,
    "comments": 18,
    "saves": 31,
    "coverTone": "green",
    "visibility": "public",
    "location_visibility": "area_blur",
    "location_text": "东湖听涛",
    "location_area_name": "武汉市",
    "latitude": null,
    "longitude": null,
    "equipment_ids": [],
    "created_at": "2026-06-02T00:00:00+00:00",
    "updated_at": "2026-06-02T00:00:00+00:00"
  },
  {
    "id": "post_003",
    "user_id": "demo_user",
    "post_type": "空军",
    "format": "图文",
    "author": "空军也要发",
    "avatar": "K",
    "title": "空军也值得发：今天不是没鱼，是选点错了",
    "content": "把这次空军记录下来，下一次就不会再犯同样的错。岸边太陡、风向不对、鱼口窗口太短。",
    "excerpt": "今天不是没鱼，是选点错了。",
    "meta": "南湖 · 复盘 · 空军记录",
    "poi_id": "poi_003",
    "poi_name": "南湖练竿塘",
    "record_id": null,
    "content_type": "空军",
    "fish_species": [],
    "tags": ["#空军复盘", "#选点", "#经验"],
    "images": [],
    "likes": 74,
    "comments": 24,
    "saves": 19,
    "coverTone": "amber",
    "visibility": "public",
    "location_visibility": "city_only",
    "location_text": "南湖",
    "location_area_name": "武汉市",
    "latitude": null,
    "longitude": null,
    "equipment_ids": [],
    "created_at": "2026-06-02T00:00:00+00:00",
    "updated_at": "2026-06-02T00:00:00+00:00"
  },
  {
    "id": "post_004",
    "user_id": "demo_user",
    "post_type": "鱼获",
    "format": "视频",
    "author": "钓场探路官",
    "avatar": "T",
    "title": "新手第一条鱼：看调漂和抄网配合就够了",
    "content": "这条短视频把入门最容易卡住的两个动作拆开讲，适合第一次带装备出门的人。",
    "excerpt": "新手第一条鱼：看调漂和抄网配合就够了。",
    "meta": "南湖练竿塘 · 入门视频",
    "poi_id": "poi_003",
    "poi_name": "南湖练竿塘",
    "record_id": null,
    "content_type": "视频",
    "fish_species": ["鲫鱼"],
    "tags": ["#教程", "#视频", "#入门"],
    "images": [],
    "likes": 211,
    "comments": 51,
    "saves": 88,
    "coverTone": "purple",
    "visibility": "public",
    "location_visibility": "city_only",
    "location_text": "南湖练竿塘",
    "location_area_name": "武汉市",
    "latitude": null,
    "longitude": null,
    "equipment_ids": [],
    "created_at": "2026-06-02T00:00:00+00:00",
    "updated_at": "2026-06-02T00:00:00+00:00"
  }
]
